title,company,location,description,link,want to get,ranking
Sustainable Agriculture Specialist,Tesco,"Welwyn Garden City, Hertfordshire, AL7 1GA","About the roleYou will manage agricultural projects across a number of key initiatives including supporting delivery of our sustainable feed commitments and managing our Future Farmer Programme.You will be responsible forSupporting the delivery of the long term strategy for Tesco agriculture supply chains, with a speific focus on sustainable feed and supporting our suppliers to meet our deforestation and conversion free commitments.This includes supporting the agriculture and environment teams in embedding sustainable feed requirements within our categories and supply chains, supporting suppliers on innovation and alternative feeds and working with our government affairs team to drive any policy or advocacy asks.Working with colleagues, suppliers and producers to help them better understand and meet customer expectations on environmental, animal health & welfare and farming best practice.Working as part of the Sustainable Agriculture team and broader Sustainability Team, sharing learnings across our function and taking ownership of cross-cutting elements and projects within our strategy.Owning and project managing a number of initiatives including (but not limited to) the next phase of our Future Farmer Programme, supporting the Agri T Jam and the agriculture team\'s input into Tesco\'s presence at the major Agriculture Shows.Building strong internal relationships with our commercial, technical and standards and audit team as well as key external relationships including our external data service providers, suppliers and farmers.You will needOperational Skills:Microsoft OfficeStakeholder ManagementProject ManagementSupplier ManagementExperience:Degree in Agriculture, sustainability or related subject (such as animal science, farm business management etc)Experience within the agriculture industry or sustainability sector relating to agricultureExperience of project management, delivering and sustaining change#LI-DS1​#LI-HybridWhat’s in it for youWe offer excellent benefits that help make Tesco a great place to work! These include but are not limited to:Annual bonus schemeHoliday starting at 20 days plus a personal day rising to 22 days after 12 months (plus Bank holidays)Retirement savings plan - save between 4% and 7.5% and Tesco will match your contributionLife Assurance - 5 x contractual pay24/7 virtual GP service, Employee Assistance Programme (EAP) for you and your family, free access to a range of experts to support your mental wellbeingThe right to request flexible working from your first day with us26 weeks maternity and adoption leave (after 1 years’ service) at full pay, followed by 13 weeks of Statutory Maternity Pay or Statutory Adoption Pay and we also offer 4 weeks fully paid paternity leaveGreat colleague deals and discounts, saving you money on everyday purchases, eating out and utility bills for the homeAccess to our colleague networks providing a space for colleagues to come together from a range of backgrounds. For more information about our colleague networks please click hereOpportunities to get on - take advantage of our ongoing learning opportunities and award-winning training, to help you achieve the job and career you wantClick Here to read more about the benefits we have available for our colleaguesAbout usTesco has become a market leader by doing the little things that really matter for our customers and colleagues.It’s part of what makes Tesco such a great place to work, and we’re proud to have been accredited as one of Britain’s Top Employers again this year.We're the UK's number one retailer and we pride ourselves on offering a great shopping experience. We are passionate about our food, merchandise and services and will always try to get things right for our customers.But did you know we also offer great job opportunities? With stores, distribution centres and offices across the UK, and a vast variety of roles, we are always looking for people who have a hunger to work with customers and colleagues across our exciting business.We believe in treating each other with respect and giving everyone an equal opportunity to get on. It's our people that make the difference every day - helping us make a difference for our customersShould you be successful in your application, your offer will be subject to and conditional upon you providing your bank account details before your agreed start date.For more information about us please visit www.tescoplc.comProud member of the Disability Confident employer schemeDisability ConfidentAbout Disability ConfidentA Disability Confident employer will generally offer an interview to any applicant that declares they have a disability and meets the minimum criteria for the job as defined by the employer. It is important to note that in certain recruitment situations such as high-volume, seasonal and high-peak times, the employer may wish to limit the overall numbers of interviews offered to both disabled people and non-disabled people. For more details please go toDisability Confident.",https://findajob.dwp.gov.uk/details/13844683,,
"Environment, Sustainability & Energy Officer | Blackpool Teaching Hospitals NHS Foundation Trust",Blackpool Teaching Hospitals NHS Foundation Trust,"Blackpool, FY48NR","Please note that this role is advertised on behalf of Atlas BFW Management Ltd (Atlas), a wholly-owned subsidiary of Blackpool Teaching Hospitals NHS Foundation Trust and as such, successful applicant(s) will be on Atlas Terms and Conditions. For further information about Atlas, please visit: www.bfwml.co.ukThe successful post holder will work in a small team of health, safety, environment, and fire safety specialists in managing KPIs for Environmental, Sustainability & Energy. Duties include production of climate change risk assessments, advising service users on management of environment, sustainability & energy, assisting with the maintenance of emergency planning documentation.You will need excellent IT skills and can produce and present reports. Working closely with our client base, IPCC, clinical users, and external organisations you will support the Health, Safety, Environment & Quality (HSEQ) Manager in meeting legislative obligations.Lead with the progression of the Atlas Sustainability Plan, enduring progress is monitored, and key milestones are achieved. Act as Chair of the Sustainable Working Group in the absence of the Director of Operations. To support Atlas in its annual data returns (e.g., ERIC/PAM) and annual Board and Sustainability Reports Assist with all contractual requirements in relation to response and delivery of KPI’s and reactive activities. Conduct assessments/audits of linked departments to aid in maintaining ISO accreditations. Record information from various meters on site (e.g., water, gas, electric) and measure usage against baseline objectives and identify any significant spikes then complete associated reports as required. Production of reports as required for Atlas OMG and Board, and the Trust and as part of corporate governance reporting framework, in relation to environment & sustainability matters. Conduct audits and inspections around the site to aid in identifying areas where resources may be lost (e.g., uncapped leeks from buildings coming from a serviced water source. To assist with completion of climate change risk assessments Deputise for the Energy Manager for environmental, sustainability and energy at appropriate internal functions and meetings with the Trust and at appropriate external functions and meetings. Use effective communication channels between Atlas and the Client/organisation in relation to environmental, sustainability and energy specialist advice.As experts in healthcare facilities and property management, we deliver fully-managed healthcare facilities services and property management solutions to clients throughout Blackpool, Fylde, Wyre and North Lancashire.Our teams ensure our clients’ properties and amenities provide the best environment for their customers, patients, staff and visitors.As a wholly owned subsidiary of Blackpool Teaching Hospitals NHS Foundation Trust, we support the Trust’s frontline clinical services and assist with the delivery of patient care, through our service provision.Our profits are used to help grow our business, whilst providing additional employment, training and development opportunities for local people.Visit: bfwml.co.uk for further information.Please ensure you have read the Job Description & Person Specification before applying for this post.Main duties and Responsibilities:• Contribute to achieving and maintaining quality outcomes and standards.• Ensure compliance with Data Protection Act and General Data Protection Regulation principles and promote Information Governance.• Be required to work independently and be responsible for their own day to day planning and organisation required to fulfil the duties and responsibilities of the post.• Act in a way that is compliant with the Atlas Financial Governance Framework in the discharge of any budget management responsibilities; and, where designated as a budget holder for assigned functions and teams, be responsible for ensuring that pay and non-pay related expenditure within the department is managed appropriately, within budget, and that the appropriate documentation is available for scrutiny.• Ensure that work is undertaken in line with appropriate policies, procedures and Standard Operating Procedures (SOPs).• Ensure that the ordering, receipting, storage, and controlled usage of any materials required for both the acute estates services (procurement/requisitioning), is undertaken via the appropriate systems and in line with agreed SFIs, policies and procedures.• Ensure that all official records are maintained as appropriate.• When required, deal and respond efficiently with any concerns or complaints in line with the Atlas complaints procedure.• Attend any training courses as deemed necessary by Atlas’ management and identify own personal training requirements and opportunities. Keep knowledge and skills up to date with Continuing Professional Development (CPD) and participation in the Atlas Mandatory Training scheme as appropriate.• Where required, represent Atlas with active participation in both national and regional level external working groups.• Undertake benchmarking exercises with appropriate datasets to seek continuous improvement ideas.• Attend periodic seminars / user groups organised by NHS bodies to keep up to date with the latest policies and directives and to share best practice.• Any other duties deemed commensurate with the post.• Be available for on-call and out of hours activities as directed from time to time• Exert physical effort for several long periods during a shift.• Work at heights, carrying health and safety equipment and tools, coming into contact with dust and dirt on site and health and safety equipment.• Use surveying tools and measuring equipment. This could be daily and may involve working at height (ladders, access to ceilings etc.)• • Ensure that individual objectives are undertaken on an annual basis and that that associated action plans are developed and completed. Be able to conduct oneself in meetings professionally and be able to be entrusted with sensitive information. Have frequent exposure to unpleasant working conditions as part of risk assessment, audits, and surveys.• Demonstrate effective communication skills, being able to communicate with all stakeholders, including clients, visitors, external third-party contacts, senior managers and staff from other departments.The job description is not intended to be exhaustive, and it is likely that duties may be altered from time to time in the light of changing circumstances and following discussions with the post holder.The post holder may be required to work across the Company at any time throughout the duration of their contract, which may entail travel and working at a different location and attending other sites as necessary.As post requires travel to sites across the organisational footprint, the post holder must hold a valid clean driving licence and have access to their own vehicle.This advert closes on Wednesday 24 Jan 2024Proud member of the Disability Confident employer schemeDisability ConfidentAbout Disability ConfidentA Disability Confident employer will generally offer an interview to any applicant that declares they have a disability and meets the minimum criteria for the job as defined by the employer. It is important to note that in certain recruitment situations such as high-volume, seasonal and high-peak times, the employer may wish to limit the overall numbers of interviews offered to both disabled people and non-disabled people. For more details please go toDisability Confident.",https://findajob.dwp.gov.uk/details/13761287,,
28433 - Next Delivery Vehicle Environment and Sustainability Advisor - NEAS Team 2100,Environment Agency,London,"Are you passionate about protecting people and wildlife of London from tidal flood risk?Do you want to be involved in world leading adaptive flood risk management programme?Do you enjoy advocating for positive environmental and sustainability outcomes?Does managing varied portfolio of environmental projects excite you?This is an influential and exciting Environment and Sustainability Advisor position at the heart of the Next Delivery Vehicle, developing the approach to environmental compliance and sustainable conformance for the next period of flood risk management in the Thames Estuary. As a key part of a collaborative team this position directly supports implementing the Environment Agency’s Thames Estuary 2100 Plan. The trailblazing adaptive management plan sets out how we will manage tidal flood risk in London and the Thames Estuary throughout the 21st century.• We enable the Environment Agency to be a leader in the provision of sustainable infrastructure.• We support the adoption of innovative approaches to achieve sustainable outcomes.• We ensure environmental compliance and sustainability conformance.• We identify and deliver environmental enhancements to create a better place.You will work collaboratively to deliver ground-breaking and award-winning work, leaving a legacy for the future. This will be achieved in collaboration with a network of stakeholders. These include internal departments, statutory bodies, delivery partners, businesses, and communities.Your approach and positivity will motivate and inspire the team to achieve successful multi-benefit schemes which enhance the environments and communities we work withinResponding to incidents is a central part of what we do. You will be required to have an incident role and make yourself available to respond to incidents or provide business continuity support during an incident. This may attract an additional payment and full training and alternative working arrangements will be available to support you with your incident role.The teamYou will be member of the National Environmental Assessment and Sustainability (NEAS) team, which is helping develop the Next Delivery Vehicle. Our inclusive team puts sustainability at the heart of decision-making across this Flood Risk Management programme. We oversee the effective management of environmental compliance and sustainability conformance across the Next Delivery Vehicle Project.We are comprised of Environmental Project Managers, Sustainability specialists, Landscape and Heritage specialists as well as support and leadership colleaguesExperience/skills requiredYou will have (essential):• Great communication skills and the ability to develop and maintain effective relationships with internal and external customers and partners.• Experience in collaborating with others to deliver environment and sustainability benefits and manage environmental risk and be able to communicate this effectively.• A good understanding of different technical areas of expertise, such as sustainability, habitats regulations, environmental net gain, natural capital, circular economy, social value, planning or environmental design.• Programme and/or project management skills.• Experience in mentoring and supporting colleagues with varying degrees of experience.Desirable:• Writing or reviewing environmental reports would be an advantage.• Membership of relevant professional environmental institute.• Knowledge of flood and coastal risk management and/or asset management.",https://findajob.dwp.gov.uk/details/13805613,,
28433 - Next Delivery Vehicle Environment and Sustainability Advisor - NEAS Team 2100,Environment Agency,Norwich,"Are you passionate about protecting people and wildlife of London from tidal flood risk?Do you want to be involved in world leading adaptive flood risk management programme?Do you enjoy advocating for positive environmental and sustainability outcomes?Does managing varied portfolio of environmental projects excite you?This is an influential and exciting Environment and Sustainability Advisor position at the heart of the Next Delivery Vehicle, developing the approach to environmental compliance and sustainable conformance for the next period of flood risk management in the Thames Estuary. As a key part of a collaborative team this position directly supports implementing the Environment Agency’s Thames Estuary 2100 Plan. The trailblazing adaptive management plan sets out how we will manage tidal flood risk in London and the Thames Estuary throughout the 21st century.• We enable the Environment Agency to be a leader in the provision of sustainable infrastructure.• We support the adoption of innovative approaches to achieve sustainable outcomes.• We ensure environmental compliance and sustainability conformance.• We identify and deliver environmental enhancements to create a better place.You will work collaboratively to deliver ground-breaking and award-winning work, leaving a legacy for the future. This will be achieved in collaboration with a network of stakeholders. These include internal departments, statutory bodies, delivery partners, businesses, and communities.Your approach and positivity will motivate and inspire the team to achieve successful multi-benefit schemes which enhance the environments and communities we work withinResponding to incidents is a central part of what we do. You will be required to have an incident role and make yourself available to respond to incidents or provide business continuity support during an incident. This may attract an additional payment and full training and alternative working arrangements will be available to support you with your incident role.The teamYou will be member of the National Environmental Assessment and Sustainability (NEAS) team, which is helping develop the Next Delivery Vehicle. Our inclusive team puts sustainability at the heart of decision-making across this Flood Risk Management programme. We oversee the effective management of environmental compliance and sustainability conformance across the Next Delivery Vehicle Project.We are comprised of Environmental Project Managers, Sustainability specialists, Landscape and Heritage specialists as well as support and leadership colleaguesExperience/skills requiredYou will have (essential):• Great communication skills and the ability to develop and maintain effective relationships with internal and external customers and partners.• Experience in collaborating with others to deliver environment and sustainability benefits and manage environmental risk and be able to communicate this effectively.• A good understanding of different technical areas of expertise, such as sustainability, habitats regulations, environmental net gain, natural capital, circular economy, social value, planning or environmental design.• Programme and/or project management skills.• Experience in mentoring and supporting colleagues with varying degrees of experience.Desirable:• Writing or reviewing environmental reports would be an advantage.• Membership of relevant professional environmental institute.• Knowledge of flood and coastal risk management and/or asset management.",https://findajob.dwp.gov.uk/details/13805619,,
28433 - Next Delivery Vehicle Environment and Sustainability Advisor - NEAS Team 2100,Environment Agency,Reading,"Are you passionate about protecting people and wildlife of London from tidal flood risk?Do you want to be involved in world leading adaptive flood risk management programme?Do you enjoy advocating for positive environmental and sustainability outcomes?Does managing varied portfolio of environmental projects excite you?This is an influential and exciting Environment and Sustainability Advisor position at the heart of the Next Delivery Vehicle, developing the approach to environmental compliance and sustainable conformance for the next period of flood risk management in the Thames Estuary. As a key part of a collaborative team this position directly supports implementing the Environment Agency’s Thames Estuary 2100 Plan. The trailblazing adaptive management plan sets out how we will manage tidal flood risk in London and the Thames Estuary throughout the 21st century.• We enable the Environment Agency to be a leader in the provision of sustainable infrastructure.• We support the adoption of innovative approaches to achieve sustainable outcomes.• We ensure environmental compliance and sustainability conformance.• We identify and deliver environmental enhancements to create a better place.You will work collaboratively to deliver ground-breaking and award-winning work, leaving a legacy for the future. This will be achieved in collaboration with a network of stakeholders. These include internal departments, statutory bodies, delivery partners, businesses, and communities.Your approach and positivity will motivate and inspire the team to achieve successful multi-benefit schemes which enhance the environments and communities we work withinResponding to incidents is a central part of what we do. You will be required to have an incident role and make yourself available to respond to incidents or provide business continuity support during an incident. This may attract an additional payment and full training and alternative working arrangements will be available to support you with your incident role.The teamYou will be member of the National Environmental Assessment and Sustainability (NEAS) team, which is helping develop the Next Delivery Vehicle. Our inclusive team puts sustainability at the heart of decision-making across this Flood Risk Management programme. We oversee the effective management of environmental compliance and sustainability conformance across the Next Delivery Vehicle Project.We are comprised of Environmental Project Managers, Sustainability specialists, Landscape and Heritage specialists as well as support and leadership colleaguesExperience/skills requiredYou will have (essential):• Great communication skills and the ability to develop and maintain effective relationships with internal and external customers and partners.• Experience in collaborating with others to deliver environment and sustainability benefits and manage environmental risk and be able to communicate this effectively.• A good understanding of different technical areas of expertise, such as sustainability, habitats regulations, environmental net gain, natural capital, circular economy, social value, planning or environmental design.• Programme and/or project management skills.• Experience in mentoring and supporting colleagues with varying degrees of experience.Desirable:• Writing or reviewing environmental reports would be an advantage.• Membership of relevant professional environmental institute.• Knowledge of flood and coastal risk management and/or asset management.",https://findajob.dwp.gov.uk/details/13805630,,
